{
  "decision_id": "01HW9P6XJC2E8YB4PQTKR9V3ZN",
  "timestamp": "2026-05-09T13:46:11.012Z",
  "coach_run_id": "run-2026-05-09-coach-v9-bootstrap",
  "issue_number": 483,
  "decision_type": "escalation",
  "inputs": {
    "trigger": "process_silence",
    "agent_id": "agent-K1-tester",
    "silent_for_seconds": 1800
  },
  "outcome": {
    "action": "respawn",
    "previous_pid": 42891
  },
  "rationale": "Agent silent past the 30-minute heartbeat threshold; no recent stdout, no recent commits. Respawn rather than escalate to human because the behavior matches a known transient cmux hang.",
  "judgment_id": "01HW9P6XK1G7H4ZN2A5DYJ8Q3X"
}
